slug,name,api_provider,any_api,logo_url,logo_background_color,preferred,provider_name,raml,raml_url,description,zapier_descripcion,pw_description,c_description,api_endpoint,API Homepage,primary_category,secondary_categories,Protocol / Formats,Other options,SSL Support,API Kits,API Forum,Contact Email,Developer Support,Authentication Mode,discoveryRestUrl
coinbase,Coinbase,https://www.coinbase.com,,,,,,,,,,"Coinbase is an electronic service and ""wallet"" for bitcoins and digital currency. Users can transfer currency, pay merchants, and make other payments instantly. The Coinbase API allows developers to access and integrate the functionality of Coinbase with other applications. Some example API methods include retrieving account information and balances, sending money, requesting money, and managing user information.","The easiest way to buy, use, and accept bitcoin.",,,billing,,,,,,,,,,
composer,Composer,https://getcomposer.org,,,,,,,,,,,Dependency management for PHP.,,,package-management,,,,,,,,,,
confluence,Confluence,https://www.atlassian.com/software/confluence,,,,,,,,,,,"Trusted by thousands, Confluence is the leading team and content collaboration tool helping teams get more work done, faster.",,,collaboration,,,,,,,,,,
constant-contact,Constant Contact,http://www.constantcontact.com/index.jsp,,,,,,,,,,,"Email, Event, and Social Media marketing tools and solutions from Constant Contact make it easy to reach, engage, acquire, and retain customers or members.",,,email-marketing,Email Marketing | Event Management,,,,,,,,,
contact-us-dot-com,ContactUs.com,,,,,,,,,,"ContactUs.com increases the amount of website visitors that become contacts by using behavioral triggers, helps you start the conversation with those visitors with a basic CRM, tells you where your leads come from and what they do in your website.",,,,,,,,,,,,,,,
contactually,Contactually,,,,,,,,,,,"Contactually is a customer relationship management system. Some features of Contactually include automatic contact management, recommended actions for contacts based on history, and exploring other opportunities through the user's network. The Contactually API allows developers to access and integrate the functionality with other applications. Some example API methods include managing contacts, retrieving contact histories, and listing information about contacts.",,,,,CRM,,,,,,,,,
contentful,Contentful,,,,,,,,,,,"Contentful is a content management system (CMS) for mobile and web applications. Contentful offers a variety of CMS features for mobile and web app publishers and delivers the content to multiple channels from the CMS. The Contentful API allows developers to access and integrate the functionality of Contentful with other applications. Some example API methods include setting up content spaces, retrieving content, pushing content out, and managing content.",,,,,CMS,,,,,,,,,
context,Context.IO,https://context.io,https://any-api.com/consoles/citycontext.com/1.0.0,,,,,,,,,,Context.IO is a REST email API that makes it easy and fast to integrate your user's email data in your application.,,,email,,,,,,,,,,
convo,Convo,,,,,,,,,,,Convo is a collaboration platform for distributed work teams. Convo offers an online platform and features for teams to stay connected to collaborate on work and projects. The Convo API allows developers to access and integrate the functionality of Convo with other applications. The main API method is to customize and integrate conversation feeds from the collaboration platform.,,,,,Project Management | Social,,,,,,,,,
core,CORE,,https://any-api.com/consoles/core.ac.uk/2.0,,,,,,,,,,,,,,,,,,,,,,,
couchdb,CouchDB,http://couchdb.apache.org,,,,,,,,,,,"CouchDB is a database that completely embraces the web. Store your data with JSON documents. Access your documents with your web browser, via HTTP.",,,database,,,,,,,,,,
coveralls,Coveralls,https://coveralls.io,,,,,,,,,,,"Software testing history and statistics. Track your projects' code coverage over time, changes to files, and badge your GitHub repo.",,,code-coverage,,,,,,,,,,
cpan,CPAN,http://www.cpan.org,,,,,,,,,,,"CPAN is the Comprehensive Perl Archive Network, a large collection of Perl software and documentation.",,,package-management,,,,,,,,,,
craigslist,Craigslist,http://charlotte.craigslist.org,,,,,,,,,,,"Craigslist provides local classifieds and forums for jobs, housing, for sale, personals, services, local community, and events.",,,,,,,,,,,,,
credit-repair-cloud,Credit Repair Cloud,,,,,,,,,,Cloud-based Credit Repair Software and CRM. For mortgage brokers and entrepreneurs. Help your clients or start a credit repair business.,,,,,,,,,,,,,,,
crittercism,Crittercism,,,,,,,,,,,Crittercism is a mobile application error monitoring and network monitoring service. Crittercism allows application owners and developers access application diagnostics and identify errors and problems. The Crittercism API allows developers to access and integrate the functionality of Crittercism with other applications. Public documentation is not available; API access comes with a premium Crittercism account.,,,,,Server monitoring,,,,,,,,,
cronofy-calendar-api,Cronofy Calendar Connector,,,,,,,,,,"Single connection to all major calendar services: Apple, Exchange, Office365, Live and Google",,,,,,Time Tracking,,,,,,,,,
crucible,Crucible,https://www.atlassian.com/software/crucible,,,,,,,,,,,Atlassian Crucible takes the pain out of code review. Find bugs and improve code quality through peer code review from JIRA or your workflow.,,,code-review,,,,,,,,,,
cruisecontrol,CruiseControl,http://cruisecontrol.sourceforge.net,,,,,,,,,,,CruiseControl is both a continuous integration tool and an extensible framework for creating a custom continuous build process.,,,continuous-integration,,,,,,,,,,
crunchbase,CrunchBase,https://www.crunchbase.com,,,,,,,,,,"CrunchBase is a product of TechCrunch and is a directory of technology companies, people, and investment profiles especially for companies involved in Web 2.0. The read-only API allows for retrieving all information that is available from the database, with some search criteria, and it uses JSON for the output formats. It is not necessary to have a developer account or an API key, and there are no current restrictions on the number of requests.","CrunchBase is the free database of technology companies, people, and investors that anyone can edit.",,,,,,,,,,,,,
cudadrive,CudaDrive,,,,,,,,,,"CudaDrive provides file sync and share capabilities for businesses via a local ""virtual drive"" as well as mobile and web apps. User data protection is built in, and can be enabled with one click for all your devices!",,,,,,File Management,,,,,,,,,
cudasign,CudaSign,,,,,,,,,,"CudaSign provides a secure and easy Digital Signature solution that enables you to sign, send and manage documents anywhere while using any device.",,,,,,Digital Signature,,,,,,,,,
cybertaxonomy,cybertaxonomy,,https://any-api.com/consoles/cybertaxonomy.eu/1.0,,,,,,,,,,,,,,,,,,,,,,,
cyfe,Cyfe,http://www.cyfe.com,,,,,,,,,,,Web-based software that helps companies bring all their business metrics into one single location.,,,dashboard,Charting | Developer Tools,,,,,,,,,
dailymotion,Dailymotion,http://www.dailymotion.com/us,,,,,,,,,,,"Fresh entertainment, music, gaming, comedy and sports videos.",,,social,,,,,,,,,,
daisycon,Daisycon,,https://any-api.com/consoles/daisycon.com/1.0.0,,,,,,,,,,,,,,,,,,,,,,,
dapulse,DaPulse,,,,,,,,,,,"daPulse is a tool for improving company transparency. It helps keep people at all levels of an organization apprised of its immediate and long-term plans, so that they can work toward them together. A ""Pulse"" is a collaborative space where people can communicate, share files, and develop a knowledge base. Users can easily comment on and mark up shared documents.",,,,,Project Management,,,,,,,,,
data2crm,Data2CRM,,https://any-api.com/consoles/data2crm.com/1.0.0,,,,,,,,,,,,,,,,,,,,,,,
databox,Databox,,,,,,,,,,,"Databox is a data connection and dashboard service. Databox provides features that allow users to connect to datasources, visualize data, and analyze data. The Databox API allows developers to access and integrate the functionality of Databox with other applications. Public documentation is not available; API access comes with account service. ",,,,,Charting,,,,,,,,,
datadog,Datadog,,,,,,,,,,"Datadog is a service for IT, Operations and Development teams who write and run applications at scale, and want to turn the massive amounts of data produced by their apps, tools and services into actionable insight.",,,,,,Developer Tools | Server monitoring,,,,,,,,,
datasift,DataSift,http://datasift.com,,,,,,,,,,"DataSift provides very granular and modular 'sifting' functions from across a wide range of social and web input feeds, augmenting them with sentiment analysis, storage and analytics to offer an unrivalled service platform, which leverages the cloud and scales infinitely. The DataSift API allows developers to consume filtered data from DataSift, and edit various resources hosted on the site. Some parts of the API do not require authorization, others recommend authorization, and the rest require authorization. ",DataSift offers the most powerful and sophisticated tools for extracting value from Social Data.,,,,,,,,,,,,,
datumbox,DatumBox,,https://any-api.com/consoles/datumbox.com/1.0,,,,,,,,,,,,,,,,,,,,,,,
delicious,Delicious,https://delicious.com,,,,,,,,,,,"Keep, share, and discover the best of the Web using Delicious, the world's leading social bookmarking service.",,,social,Social,,,,,,,,,
delivra,Delivra,,,,,,,,,,,"Delivra is an email marketing software firm that also provides professional consulting, design, and other services to its clients. Customers can integrate their own applications with Delivra's software using the Delivra API. Through the API, users can manage accounts settings, mailing list membership, email templates, subscriptions, and scheduled mailings. They can also record website activity that results from a mailing and retrieve a history of bounces, click-throughs, unsubscribes, and other such results. ",,,,,Email Marketing,,,,,,,,,
deploy,Deploy,https://www.deployhq.com,,,,,,,,,,,Deploy your websites or applications directly from your repository to your server.,,,,,,,,,,,,,
deputy,Deputy,,,,,,,,,,"Deputy is an all-in-one employee scheduling, timesheets, tasking and communication platform. Used by thousands of businesses around the world it will improve profitability, staff culture and operational accountability.",,,,,,Project Management | Time Tracking,,,,,,,,,
desk,Desk,http://www.desk.com,,,,,,,,,,,"Without software, Desk.com helps small businesses and growing support teams create the Happiest Customers on Earth.",,,customer-support,Help Desk,,,,,,,,,
devicemagic,Device Magic,,,,,,,,,,"Build custom forms to capture important data through your mobile device. Save time, get better data and automate your business.",,,,,,Forms | Phone,,,,,,,,,
dialmycalls,DialMyCalls,,,,,,,,,,,"DialMyCalls is a service that calls or texts phone numbers with user-created voice messages or text messages. DialMyCalls can be used for a variety of messaging needs, such as emergencies, political calls, and school updates. The DialMyCalls API allows developers to access and integrate the functionality of DialMyCalls with other applications. Some example API methods include adding and managing contacts, retrieving call history, placing calls, and creating and managing messages.",,,,,Phone,,,,,,,,,
diffbot,Diffbot,http://www.diffbot.com,,,,,,,,,,,"Diffbot is a robot that sees the web the way people do, and helps developers extract the important parts from any web page.",,,,Developer Tools ,,,,,,,,,
digitalocean,Digital Ocean,https://www.digitalocean.com,,,,,,,,,,"DigitalOcean provides a simple, cloud based virtual server (droplet) service. With over 13,000 cloud servers currently in operation, DigitalOcean is a well-established provider of online storage solutions with fast, realtime control. With a streamlined interface, users are able to create and start utilizing a virtual server in under a minute. The API provides all the same services as the web control panel to allow full control over your Droplet virtual servers. Using a simple, REST interface you can make calls for: shutting down, power cycling your virtual server, show all active droplets, take a snapshot, rebuild your droplet, and more. The API supports all major droplet functions allowing you to effectively run your server through the API.",Simple cloud hosting built for developers.,,,cloud-hosting,Developer Tools ,,,,,,,,,
diigo,Diigo,https://www.diigo.com,,,,,,,,,,"Diigo provides a browser add-on that can improve your research productivity. As you read on the web, instead of just bookmarking, you can highlight portions of web pages that are of particular interest to you. You can also attach sticky notes to specific parts of web pages.",Diigo is a powerful research tool and a knowledge-sharing community.,,,social,,,,,,,,,,
direct-mail,Direct Mail,,,,,,,,,,,"Direct Mail is a Mac OS X app for designing email newsletters, as well as creating and sending email campaigns. Includes campaign performance monitoring, subscriber list management features, and Mac business app integration capabilities. The RESTful Direct Mail API can be used to programmatically add, update, and delete messages, mailing lists, and campaign reports. To use the API, a user must have Direct Mail version 4 or later installed. API requests are authenticated with basic HTTP and authorized with an API key.",,,,,Email Marketing,,,,,,,,,
discourse,Discourse,,,,,,,,,,"Discourse is a new, modern approach to forum software. Built on Ruby on Rails, Discourse is designed to be an open platform that any one can run.",,,,,,Customer Support,,,,,,,,,
displet-retsidx,Displet,,,,,,,,,,"RETS/IDX plugin with built-in lead capture that inserts real estate listings, statistics, maps, and quick searches into Wordpress pages & widget-ready sidebars.",,,,,,Forms | Lead Generation,,,,,,,,,
disqus,Disqus,https://disqus.com,,,,,,,,,,"Disqus provides an API for users to interact with the Disqus backend. Disqus is the webwide discussion community where you carry your conversations with you. For Bloggers - Plug in and experience the best comment system, backed by your own forum. For Everyone - Claim and track your comments across blogs!",Disqus is a global comment system that improves discussion on websites and connects conversations across the web.,,,,Social,,,,,,,,,
docker,Docker,https://www.docker.com,,,,,,,,,,"Docker is an open-source platform to build, deploy, and manage containers for applications. Docker offers a variety of features that allow applications to run on any server and on multiple platforms. The Docker API allows developers to access and integrate the functionality of Docker with other applications. Some example API methods include managing user accounts, managing files, and retrieving containers and repositories and associated data.","Docker is an open-source project to easily create lightweight, portable, self-sufficient containers from any application. The same container that a developer builds and tests on a laptop can run at scale, in production, on VMs, bare metal, OpenStack clusters, public clouds and more.",,,cloud-platform,,,,,,,,,,
docsend,DocSend,https://www.docusign.com,,,,,,,,,,,Digital Signatures by DocuSign. Securely sign and send documents online from any device with the most widely used e-Signature.,,,digital-signature,CRM | FIle Management,,,,,,,,,
docusign,DocuSign,,,,,,,,,,"As the most widely used e-Signature software, Docusign makes it easy to securely sign and send documents online from any device.",,,,,,Forms,,,,,,,,,
donately,Donately,,,,,,,,,,,"Donately is a REST API that allows for users to make online donations. Donately API provides a space for non-profits to manage their donors and online giving activity. Authentication is through API token and standard HTTP and all responses, including errors, are returned in JSON. The extensive documentation of requests covers information and administrative actions regarding accounts, people, donations, and fundraisers. Donately API is a fee based service that is available for worldwide fundraising transactions.",,,,,Payment Processing,,,,,,,,,
dribbble,Dribbble,https://dribbble.com,,,,,,,,,,"Dribbble API provides access to the webdesign showcases on dribbble.com. You can access individual shots, players, comments, and more details. Note: As of Dec. 2010, no API key is required, but according to the site, this will likely change (as well as the API call limit).","Dribbble is a community of designers sharing screenshots of their work, process, and projects.",,,social,Developer Tools | Social,,,,,,,,,
drip,Drip,,,,,,,,,,,"Drip is an email marketing service designed to capture contact information from website visitors using opt-in forms. These forms only require users to make a few style choices before they're ready to go. Users can customize their automated email contact sequence based on their own blog posts or e-books, or they can use Drip's pre-made sequence blueprints. Drip's opt-in forms can be inserted into websites using a snippet of JavaScript code.",,,,,Email Marketing,,,,,,,,,
drone-io,drone.io,,,,,,,,,,,,"Hosted continuous integration and deployment for Github, Bitbucket and Google Code. Supports 12+ languages including Java, Groovy, Go, Dart and Node.",,,continuous-integration,,,,,,,,,,
dropbox,Dropbox,https://www.dropbox.com,,,,,,,,,,"Dropbox is a storage service that syncs files online and across your computers via installed software. The API allows read/write access to the same files, piggybacking on Dropbox's file synchronization and storage.","Dropbox is a free service that lets you bring your photos, docs, and videos anywhere and share them easily.",,,cloud-storage,File Management,,,,,,,,,
drupal,Drupal,https://www.drupal.org,,,,,,,,,,,"Drupal is an open source content management platform powering millions of websites and applications. It’s built, used, and supported by an active and diverse community of people around the world.",,,cms,CMS | Forms,,,,,,,,,
ducksboard,Ducksboard,https://ducksboard.com,,,,,,,,,,"Ducksboard is a web metrics and analytics platform. Ducksboard allows users to track their web metrics and produce analysis and reports based on the metrics. The Ducksboard API allows developers to access and integrate the functionality of Ducksboard with other applications. Some example API methods include retrieving data, sending data, and managing accounts. Ducksboard offers push, pull, and dashboard APIs.","Your numbers grow, all together in one screen: your web services, your SaaS, even your own internal metrics. Oh... It's so sexy.",,,dashboard,Charting | Developer Tools,,,,,,,,,
dweet,dweet.io,,https://any-api.com/consoles/dweet.io/0.2,,,,,,,,,,,,,,,,,,,,,,,
dwolla,Dwolla,,,,,,,,,,,"The Dwolla API provides an interface to integrate the Dwolla payments platform into a software application. Dwolla is a payments processor that provides a web based platform which allows users to send, receive, and request funds from any other. Dwolla can be used to share money with friends through Facebook and Twitter. Users can also purchase goods and services through the web and mobile devices. The API provides developers with the functionality to send, request, and retrieve account history and send money between Dwolla accounts. The API uses both REST and SOAP protocol and responses are formatted in XML or JSON.",,,,,Payment Processing,,,,,,,,,
e-goi,E-goi,,,,,,,,,,,"E-goi is a multichannel marketing service integrating Email, SMS, voice, fax and social media. The E-goi API provides developers with REST, SOAP, and XML-RPC interfaces for automating all aspects of E-goiâ€™s marketing services.",,,,,Email Marketing,,,,,,,,,
e-junkie,E-junkie,,,,,,,,,,Donately makes online donations dead simple and provides a space for non-profits to manage their donors and online giving activity with ease.,,,,,,Ecommerce,,,,,,,,,
ebay,eBay,http://ebay.com,,,,,,,,,,"eBay's primary web services are found in the three following API's: The [[http://www.programmableweb.com/api/ebay-trading Trading API]] is designed to provide robust support for transactional activities. The services offered by the Trading API allow developers to list items, manage user information, get item information, and manage eBay sales and purchases. The [[http://www.programmableweb.com/api/ebay-shopping Shopping API]] is a more lightweight service that is optimized for buyer shopping and browsing. The Shopping API lets users take searches off of eBay and put them into their own site or application. This API is designed for the creation of buying applications with very fast response times. The [[http://www.programmableweb.com/api/ebay-finding Finding API]] is eBay's next generation search API. The Finding API provides more relevant search results compared to existing search API's and has an array of search refinement capabilities. Developers can leverage the Finding API to integrate more robust searching and browsing experiences into their buying applications. Note: As of October 2011, eBay has deprecated the GetSearchResults and GetCategoryListings services from the Trading API, and the FindItemsAdvanced and FindItems services from the Shopping API. This functionality has been migrated to the Finding API.",eBay is an online auction and shopping website in which people and businesses buy and sell a broad variety of goods and services worldwide.,,,marketplace,ecommerce,,,,,,,,,
echosign,Echosign,https://acrobat.adobe.com/us/en/documents/esignatures.html?fromES=true,,,,,,,,,,"The EchoSign Document API allows third parties to integrate EchoSign's functionality into their own applications. If you or your users generate documents and contracts that need Digital Signatures, this API can integrate into your document flow to improve the sending, tracking, and filing process.","Adobe EchoSign offers trusted Digital Signature software online. Send, e-sign, track, and file documents and contracts securely.",,,digital-signature,Digital Signature,,,,,,,,,
ecwid,Ecwid,,,,,,,,,,,"Ecwid is an ecommerce company that provides individuals a way to create their own retail shop on the internet. The Ecwid API lets developers integrate its various services with their applications, enabling their users to directly access Ecwid account from the applications. The API is REST based, and uses OAuth 2 authentication.",,,,,Ecommerce,,,,,,,,,
egnyte,Egnyte,,,,,,,,,,,"Egnyte allows enterprises to store files in the right place based on file size, security, and compliance needs with a unique solution that can be cloud only, on-prem only or synchronized between cloud and on-prem storage. Users get the seamless access and file sharing from any device regardless of where files are stored.",,,,,File Management,,,,,,,,,
emaildirect,EmailDirect,,,,,,,,,,,"The service provides tools for managing email marketing campaigns, with bulk messaging and list management and control of feedback loops such as unsubscribe request and complaint processing. It facilitates white-listing management and handling of bounce and bad-address functions. Analytical tools include message tracking and delivery statistics. API methods support list and subscriber management (add/edit/delete), campaign configuration and message delivery, and bounced message management. Methods also support tracking by data source, subscriber history, and domain.",,,,,Email Marketing,,,,,,,,,
embedly,Embedly,http://embed.ly,,,,,,,,,,,"Embedly delivers the ultra-fast, easy to use products and tools for richer sites and apps.",,,,,,,,,,,,,
emma,Emma,http://myemma.com,,,,,,,,,,"Emma's Web Services suite will allow a client's software to access many of Emma's audience and response-tracking features. Emma offers two levels of API integration. The first is the Remote Signup feature whereby users can bypass the Emma-powered signup forms and create signup forms that are linked to their Emma account. Web Services allows a higher level of synchronization between a user database and the Emma database. The API allows functionality such as # Add or delete member fields to have your Emma email-marketing database mirror the structure of your master database # Add, edit and delete groups to mirror your master database groups/lists, and move people about from group to group # Add, edit and delete member records in your Emma database to reflect changes in yours # Retrieve overall stats for email campaigns to be merged with broader campaign reports The API uses SOAP protocol and responses are formatted in XML.","Grow your business with smart, stylish email marketing campaigns from Emma.",,,email-marketing,Email Marketing,,,,,,,,,
engineyard,Engine Yard,,,,,,,,,,,,,,,,,,,,,,,,,
envoy,Envoy,http://envoyrelate.com,,,,,,,,,,"The Envoy REST API allows developers to access and integrate the functionality of Envoy with other applications. Some example API methods include listing employees and retrieving employee details, registering visitors, and managing employee and visitor check-in. Envoy is a visitor registration platform for offices.","Donor management, real time donor analytics for your non profit and instant updates to your online marketing tools.",,,,Event Management,,,,,,,,,
epos-now,Epos Now,,,,,,,,,,"Grow and manage your business in the cloud with the Epos Now point-of-sale platform. Harness powerful reporting, inventory management and customer loyalty. Easy setup and ongoing support. Access from anywhere on any device.",,,,,,Ecommerce,,,,,,,,,
eriomem,eriomem,,,,,,,,,,,,,,,,,,,,,,,,,
