slug,name,api_provider,any_api,logo_url,logo_background_color,preferred,provider_name,raml,raml_url,description,zapier_descripcion,pw_description,c_description,api_endpoint,API Homepage,primary_category,secondary_categories,Protocol / Formats,Other options,SSL Support,API Kits,API Forum,Contact Email,Developer Support,Authentication Mode,discoveryRestUrl
papertrail,Papertrail,https://papertrailapp.com/,,,,,,,,,,,"Papertrail helps detect, resolve, and avoid infrastructure problems using log messages.",,,,,,,,,,,,,
papyrs,Papyrs,,,,,,,,,,"Dream up your own intranet site or internal wiki with simple drag & drop. Easily share and collect information, files, discussions, online forms and much more -- work better together with colleagues and clients.",,,,,,CMS,,,,,,,,,
paradiso-lms,Paradiso LMS,,,,,,,,,,"Dream up your own intranet site or internal wiki with simple drag & drop. Easily share and collect information, files, discussions, online forms and much more -- work better together with colleagues and clients.",,,,,,CMS | CRM,,,,,,,,,
pardot,Pardot,,,,,,,,,,"Pardot is no-hassle marketing automation that makes sales and marketing teams best friends. Increase marketing accountability, gain greater insight into ROI, and much more.",,,,,,Email | Email Marketing,,,,,,,,,
parse,Parse,https://parse.com/,,,,,,,https://github.com/openjaf/api_directory/tree/master/apis/parse/raml_0.8,,,,Parse is a complete technology stack to power your app’s backend.,,,cloud-platform,Developer Tools,,,,,,,,,
passwordutility,PasswordUtility.Web,,https://any-api.com/consoles/passwordutility.net/v1,,,,,,,,,,,,,,,,,,,,,,,
pastebin,Pastebin,http://pastebin.com/,,,,,,,,,,,Pastebin.com is the number one paste tool since 2002. Pastebin is a website where you can store text online for a set period of time.,,,,,,,,,,,,,
patientview,PatientView,,https://any-api.com/consoles/patientview.org/1.0,,,,,,,,,,,,,,,,,,,,,,,
paymill,Paymill,http://paymill.com/,,,,,,,,,,,Paymill enables you to offer credit card payments on your website within a short time.,,,billing,Payment Processing,,,,,,,,,
paymo,Paymo,,,,,,,,,,"Simple online project management application that bundles task management, time tracking and invoicing",,,,,,Payment Processing | Payment Processing | Time Tracking | Billing | Accounting,,,,,,,,,
paypal,PayPal,http://paypal.com/,,,,,,,https://github.com/openjaf/api_directory/tree/master/apis/paypal/raml_0.8,,,,"PayPal is the safer, easier way to pay online without revealing your credit card number.",,,billing,Payment Processing,,,,,,,,,
peel-ci,Peel Tune-in API,,https://any-api.com/consoles/peel-ci.com/1.0.0,,,,,,,,,,,,,,,,,,,,,,,
people-hr,People HR,,,,,,,,,,"People delivers an HR administration solution for HR professionals working in small and mid-sized companies. People HR constructs insightful graphic reports, offers expert “follow me” guidance, and engages people on missions through high-impact tasks.",,,,,,Billing | Accounting,,,,,,,,,
perforce,Perforce,https://www.perforce.com/,,,,,,,,,,,"Perforce is a leader in enterprise version management. Perforce takes the conflict out of collaboration by making it easy for teams to find the right digital assets, work on them in parallel and store them securely.",,,version-control,,,,,,,,,,
phabricator,Phabricator,http://phabricator.org/,,,,,,,,,,,"Phabricator is a suite of open source tools for peer code review, task management, and project communication.",,,code-review,issue-tracking,,,,,,,,,
phaxio,Phaxio,,,,,,,,,,"Super simple fax API for developers. Send and receive faxes, and pay as you go.",,,,,,Developer Tools | Phone,,,,,,,,,
philips-hue,Philips hue,http://www2.meethue.com/en-us/,,,,,,,,,,,Philips hue connected bulbs let you take control of your lighting.,,,internet-of-things,,,,,,,,,,
pinboard,Pinboard,http://pinboard.in/,,,,,,,,,,,"Pinboard is a fast, no-nonsense bookmarking site.",,,social,Bookmarking,,,,,,,,,
pingdom,Pingdom,https://www.pingdom.com/,,,,,,,,,,,Pingdom is a website monitoring service.,,,monitoring,Developer Tools,,,,,,,,,
pinterest,Pinterest,https://www.pinterest.com/,,,,,,,,,,,"A content sharing service that allows members to “pin” images, videos and other objects to their pinboard.",,,social,,,,,,,,,,
pipedrive,Pipedrive,http://pipedrive.com/,,,,,,,,,,,"Pipeline tool for active dealmakers, not your usual CRM. Helps you get super organized and close more deals, with less time needed for admin.",,,crm,,,,,,,,,,
pipelinedeals,PipelineDeals,,,,,,,,,,"Simple and useful CRM software in the cloud. Sell more today with sales tracking software. Our CRM software will help organize, track, and manage your deals, leads, and contacts.",,,,,,CRM,,,,,,,,,
pipeliner,Pipeliner,,,,,,,,,,Next generation sales CRM software designed to empower sales teams and grow profitable customer relationships.,,,,,,CRM | Lead Generation,,,,,,,,,
pivotal-tracker,Pivotal Tracker,http://www.pivotaltracker.com/,,,,,,,https://github.com/openjaf/api_directory/tree/master/apis/pivotaltracker/raml_0.8,,,,"Pivotal Tracker is an award-winning, simple, effective, agile project management tool that allows your team to collaborate around a shared backlog of stories in real time.",,,project-management,Developer Tools | Project Management,,,,,,,,,
piwik,Piwik,http://piwik.org/,,,,,,,,,,,Piwik is a free software web analytics system.,,,analytics,,,,,,,,,,
planbox,Planbox,http://planbox.com/,,,,,,,,,,,"Agile Project Management tool that is powerful yet easy to use. Plan, Collaborate and Deliver. Right out of the box.",,,project-management,,,,,,,,,,
planso,PlanSo Forms for WordPress,,,,,,,,,,PlanSo Forms is a form management and creation tool. It can be used directly or via wordpress plugin.,,,,,,Forms,,,,,,,,,
planyo-online-booking,Planyo Online Booking,,,,,,,,,,"Planyo is an online reservation system which can be used by any business taking bookings. It's used, amongst others, by businesses offering vacation properties, car rentals, hotels, driving schools, yacht charters, doctors and therapists, conference rooms, tennis courts, car parks, event tickets or any other bookings you could imagine.",,,,,,Event Management,,,,,,,,,
plaxo,Plaxo,http://plaxo.com/,,,,,,,,,,,"The leading smart address book, Plaxo unifies your contacts across sources, proactively updates contact info, and syncs your complete address book with the communication tools and services you use every day.",,,,,,,,,,,,,
plenigo,Plenigo,,https://any-api.com/consoles/plenigo.com/2.0.0,,,,,,,,,,,,,,,,,,,,,,,
plivo,Plivo,https://www.plivo.com/,,,,,,,,,,,Plivo makes it easier to build voice and SMS into your apps.,,,phone,,,,,,,,,,
pocket,Pocket,https://getpocket.com/,,,,,,,,,,,"When you find something you want to view later, put it in Pocket.",,,social,Bookmarking,,,,,,,,,
podio,Podio,https://podio.com/,,,,,,,,,,,"Podio is the online work platform. Manage, share, and get your work done smarter together with tools that work like you.",,,collaboration,CRM | Event Management | Project Management,,,,,,,,,
pollencheck,PollenCheck,,https://any-api.com/consoles/pollencheck.eu/1.0.0,,,,,,,,,,,,,,,,,,,,,,,
positionly,Positionly,,,,,,,,,,"Powerful, user-friendly SEO/Inbound tools that make improving your website’s visibility an enjoyable experience.",,,,,,Marketing,,,,,,,,,
postgresql,PostgreSQL,http://www.postgresql.org/,,,,,,,,,,,"PostgreSQL, often simply Postgres, is an object-relational database management system (ORDBMS) available for many platforms.",,,database,Developer Tools ,,,,,,,,,
postmark,Postmark,https://postmarkapp.com/,,,,,,,https://github.com/openjaf/api_directory/tree/master/apis/postmark/raml_0.8,,,,Postmark is the easiest and most reliable way to be sure your important transactional emails get to the inbox.,,,email,Developer Tools | Email Marketing,,,,,,,,,
posty-api-herokuapp,posty_API,,,,,https://any-api.com/consoles/posty-api.herokuapp.com/v1,,,,,,,,,,,,,,,,,,,,
prd-prsn,OpenClass,,https://any-api.com/consoles/prd-prsn.com/1.0.0,,,,,,,,,,,,,,,,,,,,,,,
prefinery,Prefinery,https://www.prefinery.com/,,,,,,,,,,,Launch your private beta in minutes and attract more visitors with our viral invite system.,,,,Email Marketing,,,,,,,,,
printavo,Printavo,,,,,,,,,,"Simple shop management software for screen-printers, embroiders & promotional goods manufacturers. We allow you to quickly create invoices, get art approved, collect payment, keep track of orders & more. We're currently helping over 1,000+ shops all over the world centralize their shop and save time.",,,,,,Ecommerce,,,,,,,,,
process-street,Process Street,,,,,,,,,,"Process Street is a SaaS platform that lets non-technical teams create powerful, API-driven workflows. The easiest way to document, track, automate and optimize customer-centric processes. We help sales and customer success teams drive revenue and reduce churn",,,,,,Project Management,,,,,,,,,
prodpad,ProdPad,,,,,,,,,,ProdPad is a tool that helps you achieve better products through better product management.,,,,,,Project Management,,,,,,,,,
product-hunt,Product Hunt,https://www.producthunt.com/,,,,,,,,,,,"Product Hunt is a curation of the best new products, every day. Discover the latest mobile apps, websites, and technology products that everyone is talking about.",,,,Social,,,,,,,,,
producteev,Producteev,,,,,,,,,,Producteev helps organize tasks for your team in the simplest way. Brought to you by Jive Software.,,,,,,Project Management,,,,,,,,,
project-bubble,Project Bubble,,,,,,,,,,"The simple and easy way to manage your projects. Spend less time learning a project management system, and more time being productive.",,,,,,Project Management,,,,,,,,,
project-manager,Project Manager,,,,,,,,,,"ProjectManager.com is a simple yet powerful online project management tool that enables you and your team to plan, track, monitor and report on your projects in real-time.",,,,,,Project Management,,,,,,,,,
projectplace,Projectplace,,,,,,,,,,Projectplace makes heroes of teams and project managers by providing tools for collaboration. Works perfectly with ToDo and Projectplace Boards.,,,,,,Project Management,,,,,,,,,
promoterio,Promoter.io,,,,,,,,,,Promoter.io is the easiest and most effective way to measure and track customer loyalty using the Net Promoter System®.,,,,,Sentiment Analysis,Customer Support | Surveys,,,,,,,,,
proposify,Proposify,,,,,,,,,,Streamline your proposals in the cloud with designer-friendly proposal software.,,,,,,Marketing,,,,,,,,,
prosperworks,ProsperWorks,,,,,,,,,,"ProsperWorks CRM helps you and your team sell more faster by identifying, organizing and tracking contacts and sales opportunities right in Gmail. Since ProsperWorks requires far less data entry, salespeople can focus on their deals and managers can make better decisions with accurate, real-time data. Set up takes less than five minutes and there is minimal training required.",,,,,,CRM,,,,,,,,,
proworkflow,ProWorkflow,,,,,,,,,,"Interact with Companies, Contacts, Projects, Tasks, Time, Quotes & Invoices. Take full control of integrating with ProWorkflow to build a better team.",,,,,,Project Management,,,,,,,,,
pubnub,PubNub,https://www.pubnub.com/,,,,,,,,,,,"PubNub is a blazingly fast cloud-hosted real-time messaging system to push real time data to web, tablet and mobile devices.",,,,,,,,,,,,,
pushbullet,Pushbullet,pushbullet.com,,,,,,,,,,,"Pushbullet connects your devices, making it easy and automatic to share almost anything between them.",,,notifications,Developer Tools | Phone,,,,,,,,,
pusher,Pusher,https://pusher.com/,,,,,,,,,,,"Pusher is a hosted API for quickly, easily and securely adding scalable realtime functionality to web and mobile apps.",,,,Developer Tools,,,,,,,,,
pushover,Pushover,https://pushover.net/,,,,,,,,,,,Pushover makes it easy to send notifications to your Android and iOS devices.,,,notifications,,,,,,,,,,
pushwoosh,Pushwoosh,,,,,,,,,,Cross-platform push notifications with Pushwoosh!,,,,,,Phone,,,,,,,,,
pypi,PyPI,https://pypi.python.org/pypi,,,,,,,,,,,The Python Package Index is a repository of software for the Python programming language.,,,package-management,,,,,,,,,,
qortex,Qortex,,,,,,,,,,Qortex is an online communications platform to help teams get more work done.,,,,,,Project Management | Social,,,,,,,,,
quickbase,QuickBase,,,,,,,,,,"QuickBase is a powerful online database that helps teams collect, manage, and share business information. It offers powerful customization features to let you reshape your data at will.",,,,,,CRM | Project Management | Billing | Accounting,,,,,,,,,
quickbooks,QuickBooks Online,http://quickbooks.intuit.com/,,,,,,,,,,,"QuickBooks Online accounting software automates invoicing, billing, and reporting. Easily manage bookkeeping and accounting online.",,,accounting,Billing,,,,,,,,,
quickfile,QuickFile,,,,,,,,,,"UK based cloud accounting software. Manage your accounts and bookkeeping in the cloud. QuickFile is simple to use, fast and free!",,,,,,Billing | Accounting,,,,,,,,,
quip,Quip,,,,,,,,,,"Quip is a modern productivity suite that enables you and your team to collaborate on any device. It works across iPhone, iPad, Android phones and tablets, and the desktop web. Quip has a simple and elegant interface that combines documents and messages into a single chat-like “thread” of updates, making collaboration immediate and easy. You can share documents, tables, checklists, and more so multiple people can edit and discuss together in a single, shared workspace.",,,,,,Project Management,,,,,,,,,
quixxi,Quixxi Analytics,http://www.quixxi.com/,https://any-api.com/consoles/quixxi.com/v1,,,,,,,,,,,,,,,,,,,,,,,
quora,Quora,https://www.quora.com/,,,,,,,,,,,Quora is your best source for knowledge. Quora aims to be the easiest place to write new content and share content from the web.,,,social,,,,,,,,,,
quote-roller,Quote Roller,,,,,,,,,,"Create polished, professional proposals in minutes.",,,,,,Billing | Project Management | Accounting,,,,,,,,,
rainforest-qa,Rainforest QA,,,,,,,,,,"Create polished, professional proposals in minutes.",,,,,,Developer Tools,,,,,,,,,
raven-tools,Raven Tools,,,,,,,,,,"Create polished, professional proposals in minutes.",,,,,,Marketing,,,,,,,,,
rd-station,RD Station,,,,,,,,,,"Create polished, professional proposals in minutes.",,,,,,Marketing,,,,,,,,,
reactome,reactome,,,,,,,,,,,,,,,,,,,,,,,,,
readability,Readability,https://readability.com/,,,,,,,,,,,Readability is a web and mobile app that zaps online clutter and saves web articles in a comfortable reading view.,,,social,,,,,,,,,,
realvolve,Realvolve,,,,,,,,,,"The real estate CRM that works the way you do. Manage people, listings, transactions and activities with powerful workflows.",,,,,,CRM,,,,,,,,,
reamaze,Reamaze,,,,,,,,,,"Reamaze helps small businesses and growing startups provide better customer support experiences with intuitive conversation management, simplified user interface, and a powerful set of social and integrated tools.",,,,,,Customer Support | Help Desk,,,,,,,,,
recurly,Recurly,https://recurly.com/,,,,,,,,,,,Recurly provides recurring billing management as a service to over one thousand subscription-based companies worldwide.,,,billing,Payment Processing,,,,,,,,,
redbooth,Redbooth,https://redbooth.com/,,,,,,,,,,,"Redbooth (formerly Teambox) is the most complete collaboration platform for task management, file sharing, and communication.",,,collaboration,Project Management,,,,,,,,,
reddit,Reddit,https://www.reddit.com/,,,,,,,,,,,Reddit is a social news and entertainment website where registered users submit content in the form of either a link or a text post.,,,social,Social,,,,,,,,,
redis,Redis,http://redis.io/,,,,,,,,,,,"Redis is an open source, advanced key-value store.",,,database,,,,,,,,,,
redmine,Redmine,http://www.redmine.org/,,,,,,,,,,,"Redmine is a flexible project management web application. Written using the Ruby on Rails framework, it is cross-platform and cross-database.",,,issue-tracking,Developer Tools | Project Management,,,,,,,,,
refugerestrooms,Refuge Restrooms,,https://any-api.com/consoles/refugerestrooms.org/v1,,,,,,,,,,,,,,,,,,,,,,,
repsly,Repsly,,,,,,,,,,Repsly is a field activity management software which simplifies field work. See what your field reps see in real-time and gain control of your field team.,,,,,,Messaging,,,,,,,,,
requirementone,RequirementOne,,,,,,,,,,RequirementOne is everything you need in one place to deliver a successful project.,,,,,,Project Management,,,,,,,,,
rescuetime,RescueTime,,,,,,,,,,RescueTime helps you understand how you spend your time on the computer by automatically keeping a log of the time you spend on different applications and websites. Having an accurate idea of how you time is spent makes it easy to stay productive and balanced.,,,,,,Time Tracking,,,,,,,,,
responder,Responder (רב מסר),,,,,,,,,,"Responder (רב מסר) is a leading Israeli email autoresponder platform, and is only in Hebrew. Capture leads, segment them to lists based on interest and action - and keep in touch with them via newsletters and segmented offers.",,,,,,Email Marketing,,,,,,,,,
rethinkdb,RethinkDB,,,,,,,,,,RethinkDB is an open-source distributed database built with love. It has a intuitive and expressive query language that is a joy to use.,,,,,,Developer Tools,,,,,,,,,
rev,Rev,,,,,,,,,,Rev is an audio transcription service that uses human beings to transcribe English audio or video into text.,,,,,,Billing,,,,,,,,,
reverb,Reverb,,https://any-api.com/consoles/reverb.com/2.0,,,,,,,,,,,,,,,,,,,,,,,
reviewboard,Review Board,https://www.reviewboard.org/,,,,,,,,,,,Review Board is a powerful web-based code review tool that offers developers an easy way to handle code reviews.,,,code-review,,,,,,,,,,
rezdy,Rezdy,,,,,,,,,,"Rezdy is a cloud-based reservation software and booking system, designed especially for tour, activity, shuttle bus, rental and sightseeing operators.",,,,,,Billing | Accounting,,,,,,,,,
rietveld,Rietveld,https://codereview.appspot.com/,,,,,,,,,,,Rietveld Code Review Tool,,,code-review,,,,,,,,,,
rocket-responder,RocketResponder,,,,,,,,,,Email Marketing Automation by RocketResponder makes it easy to create and send emails that get great results to grow your business.,,,,,,Email Marketing,,,,,,,,,
rollbar,Rollbar,https://rollbar.com/,,,,,,,,,,,"Rollbar collects errors that happen in your application, notifies you, and analyzes them so you can debug and fix them.",,,error-tracking,,,,,,,,,,
ronin,Ronin,https://www.roninapp.com/,,,,,,,,,,,"Online invoicing, time tracking, and client management software for small businesses.",,,time-tracking,Billing | Accounting,,,,,,,,,
roost,Roost,,,,,,,,,,Push notifications for websites.,,,,,,Developer Tools | Marketing,,,,,,,,,
rubygems,RubyGems,https://rubygems.org/,,,,,,,,,,,"The RubyGems software allows you to easily download, install, and use ruby software packages on your system.",,,package-management,,,,,,,,,,
rummblelabs,rummblelabs,,,,,,,,,,,,,,,,,,,,,,,,,
run-my-accounts,Run my Accounts,,,,,,,,,,Bookkeeping service for Swiss SME. Scan your documents and you are done.,,,,,,Billing | Accounting,,,,,,,,,
runrunit,Runrun.it,,,,,,,,,,"Runrun.it is a solution for task, time, and performance management. Simple, powerful and tightly integrated.",,,,,,Project Management | Time Tracking,,,,,,,,,
runscope,Runscope,,,,,,,,,,API debugging and testing tools for app developers.,,,,,,Developer Tools,,,,,,,,,
saasy,SaaSy,http://www.fastspring.com/subscription,,,,,,,,,,,All-in-one e-commerce & subscription management for SaaS & Web 2.0 companies.,,,billing,,,,,,,,,,
salesforce,Salesforce,https://www.salesforce.com/,,,,,,,https://github.com/openjaf/api_directory/tree/master/apis/salesforce/raml_0.8,,,,"CRM software solutions and enterprise cloud computing from salesforce.com, the leader in CRM and platform as a service.",,,crm,,,,,,,,,,
samanage,Samanage,,,,,,,,,,Modern IT management. Cloud-based IT service desk and asset management solution you'll love to use.,,,,,,Customer Support | Help Desk,,,,,,,,,
sandglaz,Sandglaz,,,,,,,,,,Sandglaz is the simplest way to manage projects with your agile team. Accomplish more with less stress.,,,,,,Project Management,,,,,,,,,
sansan,Sansan,,,,,,,,,,Sansan is a cloud based contact management system. Digitize your business cards with 99.9% accuracy and share the contact information with your colleagues. Save time and increase your business opportunities.,,,,,,Social,,,,,,,,,
sauce,Sauce,http://saucelabs.com/,,,,,,,,,,,"Cross browser testing made awesome. Selenium testing, mobile testing, JS unit testing on 275+ OS/browser platforms.",,,,,,,,,,,,,
sazneo,Sazneo,,,,,,,,,,"Boost productivity by enabling teams to communicate more effectively both internally and with teams at other companies. Have fewer meetings, fewer conference calls and experience a dramatic reduction in e-mail volume.",,,,,,Messaging,,,,,,,,,
scalr,Scalr,,,,,,,,,,"Scalr Cloud Management Platform offers a unified API and web interface for developers and IT users to access and manage infrastructure resources distributed across numerous public and private clouds, such as Amazon Web Services and OpenStack. Scalr delivers the balance required between development autonomy and IT control.",,,,,,Developer Tools | Server Monitoring,,,,,,,,,
scoopit,SendGrid,http://sendgrid.com/,,,,,,,,,,,Learn why more developers choose SendGrid’s SMTP relay services to deliver transactional emails triggered by web apps.,,,email,Email Marketing,,,,,,,,,
scout-monitoring,Scout Monitoring,,,,,,,,,,"Scout is a hosted server monitoring solution. Scout collects a wide variety of server and application metrics (server load, memory usage, network throughput, and much more), and alerts you based on specified thresholds and trends.",,,,,,CRM | Time Tracking,,,,,,,,,
scrapewebsite,Scrape Website,,https://any-api.com/consoles/scrapewebsite.email/0.1,,,,,,,,,,,,,,,,,,,,,,,
segment,Segment,https://segment.com/,,,,,,,,,,,"Segment is an analytics API which allows developers to install analytics once, and then send their data anywhere they need it.",,,analytics,,,,,,,,,,
semantria,Semantria,http://semantria.com/,https://any-api.com/consoles/semantria.com/4.0,,,,,,,,,,"Analyze your unstructured content with Semantria’s cloud-based sentiment analysis & text analysis API — a fast, powerful and reliable text mining service.",,,nlp,Sentiment Analysis,,,,,,,,,
sendgrid,SendHub,,,,,,,,,,SendGrid's cloud-based email infrastructure relieves businesses of the cost and complexity of maintaining custom email systems,,,,,,Messaging | Phone,,,,,,,,,
sendicate,Sendicate,,,,,,,,,,Simply send beautiful emails to people who matter. Sendicate is the email marketing app for smart businesses.,,,,,,Email Marketing,,,,,,,,,
sendinblue,SendinBlue,,,,,,,,,,"SendinBlue powers advanced email marketing. Send newsletter emails, manage your transactional emails and send SMS on our all-in-one advanced platform.",,,,,,Email Marketing,,,,,,,,,
sendloop,Sendloop,,,,,,,,,,"All-in-one email marketing solution for SaaS, e-commerce, application and small business owners.",,,,,,Email Marketing,,,,,,,,,
sendwithus,Sendwithus,,,,,,,,,,Sendwithus is the easiest way to send email from your app. You can manage and edit all of your marketing and transactional templates in one place and send them via the UI or directly from your app.,,,,,,Email Marketing,,,,,,,,,
sentry,Sentry,https://getsentry.com/welcome/,,,,,,,,,,,Sentry is a realtime event logging and aggregation platform.,,,error-tracking,,,,,,,,,,
setmore-appointment,SetMore Appointments,,,,,,,,,,SetMore was designed to be the perfect tool for small businesses of all sorts. We have users all over the globe that book appointments online and grow their business every day.,,,,,,,,,,,,,,,
sezion,Sezion,,,,,,,,,,Sezion helps you automatically generate thousands of personalized videos from any content feed in minutes.,,,,,,,,,,,,,,,
shareaholic,Shareaholic,https://shareaholic.com/,,,,,,,,,,,"Drive pageviews to your website with Shareaholic’s industry leading share buttons, related content plugins, analytics, and browser extensions.",,,,,,,,,,,,,
sharepoint,Sharepoint,,,,,,,,,,"SharePoint is business collaboration software that helps simplify content management, search, business intelligence. It also has a strong component around sharing for intranet and internet sites.",,,,,,,,,,,,,,,
sharpspring,SharpSpring,,,,,,,,,,"Powerful, affordable marketing tools for marketing agencies and SMBs. Features include email automation, lead capture, and a built in CRM system.",,,,,,,,,,,,,,,
shipstation,Shipstation,http://www.shipstation.com/,,,,,,,,,,,"Import, manage and ship your orders with ShipStation... the #1 choice of online sellers.",,,delivery,,,,,,,,,,
shipwire,Shipwire,,,,,,,,,,"Shipwire makes it simple to outsource ecommerce order fulfillment and logistics services for businesses. They have warehouses located in the US, Canada, UK, and Hong Kong.",,,,,,Billing | Accounting | Ecommerce,,,,,,,,,
shoeboxed,Shoeboxed,https://www.shoeboxed.com/,,,,,,,,,,,Painless receipt scanning and expense tracking.,,,expense-tracking,,,,,,,,,,
shopify,Shopify,https://www.shopify.com/,,,,,,,,,,,Shopify is a powerful ecommerce website solution that allows you to sell online by providing everything you need to create an online store.,,,ecommerce,Ecommerce,,,,,,,,,
sidekick,Sidekick,,,,,,,,,,"Sidekick is a free service that gives you email superpowers with contact insights, email tracking, and email scheduling.",,,,,,Lead Generation,,,,,,,,,
sifter,Sifter,http://sifterapp.com/,,,,,,,,,,,"Sifter is designed to be simple enough for everyone to join in on the fun. There are never any per-user fees, and your team won’t need training to use it.",,,issue-tracking,Developer Tools,,,,,,,,,
