slug,name,api_provider,any_api,logo_url,logo_background_color,preferred,provider_name,raml,raml_url,description,zapier_descripcion,pw_description,c_description,api_endpoint,API Homepage,primary_category,secondary_categories,Protocol / Formats,Other options,SSL Support,API Kits,API Forum,Contact Email,Developer Support,Authentication Mode,discoveryRestUrl
10to8,10to8  ,https://10to8.com/,,,,,,,,,,"Use the 10to8 Peer to Peer API to manage appointments or meetings. The API uses JSON/REST and authenticates via Token. Sign up for an account, both free and paid versions available, to receive your token. 10to8 API allows users to book, cancel, or change appointments. Other features include email or text reminders and an automatically updated calendar. See the API home page for more information and documentation.",42goals is a simple tool for tracking your daily goals and keeping a log of your daily activities.,https://10to8.com/api/p2p/v1/,10to8 Peer to Peer,Booking,"Event Management| Calendars
","JSON, REST",,yes,,,,,"API Key, Session",
123contactform,123ContactForm,http://www.123contactform.com,,,,,,,,,,"123ContactForm is a cloud-based form builder that allows users to build and administrate web and mobile contact forms, online registrations, surveys, e-commerce forms and any other custom form. The 123ContactForm API enables users to retrieve data about their forms, form fields, submissions and submissions count, then use them with external applications and databases.",Web-based project and task management software for your team.,,http://www.123contactform.com/api/,Tools,Surveys|Forms,"JSON, XML, REST",,no,,,,,API Key,
42goals,42goals,http://42goals.com/,,,,,,,,,,,,,,,,,,,,,,,,
46elks,46elks,http://www.46elks.com,,,,,,,,,Send and receiver SMS from customer server IDs,"Phone calls, SMS and MMS all in one easy API. Our cloud communication platform enables web developers to integrate telephony technlogy into their applications. And do things such as control incoming phone calls, build IVRs, send & receive SMS text messages and much more. We bridge the gap between the web and world of telephony. The API consists of 4 major parts: - Phone numbers - Phone calls - SMS messaging - MMS picture and video messaging The API is RESTful and all responses are in JSON. ",,https://api.46elks.com/a1/,"46elks - MMS, SMS API and Voice API",Telephony,Messaging| Voice,"JSON, REST",,yes,http://www.46elks.com/samples https://github.com/search?q=46elks,,help@46elks.com,http://www.46elks.com/contact,"HTTP Basic Auth, HTTP Basic Authentication",
4demit,4Dem.it,www.4dem.it,,,,,,,,,4Dem.it is an Italian professional email marketing platform.,,,,,email-marketing,Email Marketing,,,,,,,,,
5pmweb,5pmweb,http://5pmweb.com,,,,,,,,,,"5pm is a project management and time management tool. The 5pm SOAP API provides developers tools to access their 5pm information from their own applications. The API provides methods for Authentication, and to access Group, Project, Task, Activity, or User data. The 5pm project management API is currently in beta.",,,http://www.5pmweb.com/5pm_api.php,Project Management,,SOAP,XSD,no,,,support@5pmweb.com,,Username/password,
act-cloud,Act! Cloud,http://www.act.com/,,,,,,,,,"Act! Cloud marries the best of contact management with the best of emarketing to help you stay organized, convert new prospects, and get more from existing customers",,,,,crm,,,,,,,,,,
active-directory,Active Directory,,,,,,,,,,Microsoft's Active Directory is a directory service often bundled with Microsoft Windows Server operating systems or as a part of Azure hosting. It is an interface for user authentication and identity as well as a device (like computers or printers) registration.,,,,,developer tools,Developer Tools,,,,,,,,,
activecampaign,ActiveCampaign,http://www.activecampaign.com/,,,,,,,,,,"ActiveCampaign is a web based email marketing software that allows you to send permission based mailings to lists of subscribers. In order to use the API, you will need to write an application that can connect to the server where your Email Marketing is located, send a request to it and handle the response it receives from your Email Marketing software.",Create email marketing and HTML newsletter campaigns in minutes. Powerful email marketing software features with free premium templates.,,,email-marketing,CRM | Marketing | Email Marketing,,,,,,,,,
activecollab,Active Collab,https://www.activecollab.com/,,,,,,,,," Active Collab is a popular, all-in-one tool for project management, team collaboration and billing. Available both in cloud and self hosted versions.","ActiveCollab is a system that lets you and your team collaborate more efficiently by sharing files, discussing ideas and managing projects, as well as letting you track time, create invoices, and integrate with email services. ActiveCollabe also has a flexible interface, making it easily customizable and extensible through CSS code and the ActiveCollab API. The ActiveCollab API is a HTTP based API that returns JSON or XML data. The ActiveCollab API also comes with an API Wrapper, a set of PHP class and functions to make the API easier to work with.",Project management and collaboration tool.,,,project-management,Project Management,,,,,,,,,
acuity-scheduling,Acuity Scheduling,,,,,,,,,,"Easy online appointment scheduling software. Save time by having clients book appointments, complete custom intake forms, and pay in advance 24/7 anywhere in the world.",,,,,,Time tracking,,,,,,,,,
agile-crm,Agile CRM,https://www.agilecrm.com/,,,,,,,,"Agile CRM is sales and marketing automation software for small businesses. Agile CRM includes telephony, contact management, deals, web forms and email campaigns.","Agile CRM offers contact management, marketing automation, telephony, analytics, web engagement, real-time alerts and social suite. Track, nurture, and sell like a pro.","Agile CRM is a customer relationship management (CRM) service geared toward small businesses. It helps users manage individual contacts using tags, a lead scoring system, event tracking, and timelines. Users can implement automated campaigns across multiple channels (e.g. email, phone, social networks). Agile CRM's analytics and sentiment-tracking services can tell the user what's working and what isn't. Agile CRM is able to integrate with other websites and apps using plug-ins or its API. ",,https://{domain}.agilecrm.com/dev/,https://www.agilecrm.com/api/index,Enterprise,Marketing | CRM,XML | JSON | REST,JavaScript,Yes,PHP,,care@agilecrm.com,https://github.com/agilecrm,,
agilezen,AgileZen,http://www.agilezen.com/,,,,,,,,,,"The AgileZen API provides developer access to the functionality of the AgileZen application. AgileZen is a web-based project management application built on ideas from lean manufacturing. The API provides functionality such as getting projects, project details, phases, members, roles and more. The API uses RESTful protocol and responses are formatted in XML and JSON.","AgileZen is a simple, flexible, and cost-effective web-based software for project management built on ideas from agile, lean, and kanban methodologies.",,,project-management,Project Management,,,,,,,,,
aha,Aha!,,,,,,,,,,"Aha! is the new way to create brilliant product strategy and roadmaps. Our cloud-based product roadmap software allows you to focus on setting the right product strategy, scheduling market-impacting releases, defining customer-driven features, and capturing new ideas.","Aha! is a cloud-based collaboration service for product-building teams. It allows teams to map their product strategies and keep everyone apprised of upcoming release dates and work sprints. Teams can also gather and refine their features and user stories together in one place. Aha! allows teams to present product roadmaps as Notebooks, PDFs, or web pages. In fact, nearly any view from Aha! can be published in these three formats. Users can make their projects accessible from other applications using the Aha! REST and JavaScript APIs",,,,,Project Management,,,,,,,,,
aim,AIM,https://my.screenname.aol.com,,,,,,,,,,,AIM is the simplest way to chat and share with people and groups you care about.,,,messaging,,,,,,,,,,
airbnb,AirBnB,https://www.airbnb.com/,,,,,,,,,,,Rent unique accommodations from local hosts in 190+ countries. Feel at home anywhere you go in the world with Airbnb.,,,,Ecommerce,,,,,,,,,
airbrake,Airbrake,https://airbrake.io,,,,,,,,,,"Airbrake is an application that gathers errors caused by other applications. Airbrake provides reports on the errors for review and analysis, as well as auto resolving based on specifications. The Airbrake API allows developers to access and integrate Airbrake functionality into other applications. Some example API methods include accessing account and project information, receiving notifications of errors, and getting information on specific errors.","Airbrake collects errors generated by other applications, and aggregates the results for developer review.",,,error-tracking,Developer Tools | Server monitoring,,,,,,,,,
airtable,Airtable,,,,,,,,,,,The Airtable REST API allows developers to access and integrate the functionality of Airtable with other applications through JSON. Public documentation is not available; API access comes with account service. Airtable is a data organization platform that allows users to organize data through spreadsheets and data management tools.,,,,,Developer Tools,,,,,,,,,
akismet,Akismet,http://akismet.com,,,,,,,,,,,A plugin which identifies and blocks comment and trackback spam on blogs with integration to various blogging systems.,,,,,,,,,,,,,
akna,Akna,,,,,,,,,,E-mail Marketing Software,,,,,,Email Marketing,,,,,,,,,
alexa,Alexa,http://www.alexa.com,,,,,,,,,,analytics,"Alexa provides analytical insights to benchmark, compare and optimize businesses on the web.",,,,,,,,,,,,,
alfred,Alfred,https://www.alfredapp.com,,,,,,,,,,,"Alfred is a productivity application for Mac OS X, which aims to save you time in searching your local computer and the web.",,,Project Management,,,,,,,,,,
alfresco,Alfresco,https://www.alfresco.com,,,,,,,,,,,Alfresco is the open platform for business critical document management.,,,cms,,,,,,,,,,
allthings,Allthings,,,,,,,,,,"allthings increases productivity by enabling better management and distribution of work within a team. People know what work they are doing, what they are doing next and when it’s due. Agile teams using Scrum, Kanban or similar can easily manage their backlog and sprints.",,,,,,Project Management,,,,,,,,,
alterdesk,Alterdesk,,,,,,,,,,"Alterdesk is a user-friendly, secure messenger for teams. Send messages and files to your co-workers and other business contacts, using any available device!",,,,,,messaging,,,,,,,,,
amazon-clouddrive,Amazon CloudDrive,https://www.amazon.com/clouddrive/home,,,,,,,,,,,"Store your photos, documents, videos and other files in Amazon Cloud Drive and never worry about losing them again.",,,cloud-storage,Developer Tools,,,,,,,,,
amazon-cloudfront,Amazon CloudFront,,,,,,,,,,"Amazon CloudFront is a content delivery web service. It integrates with other Amazon Web Services products to give developers and businesses an easy way to distribute content to end users with low latency, high data transfer speeds, and no minimum usage commitments.",,,,,,Developer Tools,,,,,,,,,
amazon-cloudwatch,Amazon CloudWatch,,,,,,,,,,,"Amazon CloudWatch is a web service that provides visibility into your cloud assets. Amazon CloudWatch provides the data you need to make informed decisions. It is designed to provide comprehensive monitoring for all of the following AWS services: Amazon Elastic Compute Cloud or Amazon EC2 (including instances of paid AMIs), and Elastic Load Balancing.",,,,,Developer Tools,,,,,,,,,
amazon-dynamodb,Amazon DynamoDB,,,,,,,,,,"Amazon's DynamoDB is a fast NoSQL database service. It is fully managed, simple and cost-effective. It can store and retrieve any amount of data and serve any level of request traffic.",,,,,,Developer Tools,,,,,,,,,
amazon-ec2,Amazon EC2,http://aws.amazon.com/ec2/,,,,,,,,,,"The Amazon Elastic Compute Cloud (Amazon EC2) API is a web service that enables you to launch and manage Linux/UNIX and Windows server instances in Amazon's data centers. Giving users the ability to ""compute"" in the cloud, it provides users with complete control of their computing resources and lets them run on Amazon's computing environment. Amazon EC2 changes the economics of computing by allowing users to pay only for capacity that is actually used. Amazon EC2 provides two APIs: SOAP and REST. The same XML body is returned in both the REST API and SOAP API. The WSDL for each supported API version is available from the following URI: http://ec2.amazonaws.com/doc//AmazonEC2.wsdl The WSDL should be treated as a moving target as it will always map to the latest release of the Amazon EC2 SOAP API. ","Amazon Elastic Compute Cloud delivers scalable, pay-as-you-go compute capacity in the cloud.",,,cloud-platform,Developer Tools,,,,,,,,,
amazon-payments,Amazon Payments,https://payments.amazon.com/home,,,,,,,,,,,Amazon Payments is a service that provides you with the ability to send and receive payments for goods or services by using the payment methods already associated with your Amazon.com account.,,,billing,Developer Tools,,,,,,,,,
amazon-rds,Amazon RDS,,,,,,,,,,Amazon RDS,,,,,,Developer Tools,,,,,,,,,
amazon-redshif,Amazon Redshift,,,,,,,,,,,"Amazon Redshift is a cloud based fully managed, petabyte-scale data warehouse service. Amazon Redshift manages all the work needed to set up, operate, and scale a data warehouse cluster, from provisioning capacity to monitoring and backing up the cluster, to applying patches and upgrades. Developers interested in the API should contact Amazon for a limited preview of the service.",,,,,Developer Tools,,,,,,,,,
amazon-s3,Amazon S3,http://aws.amazon.com/s3/,,,,,,624ec1d69702d7dba003700,https://github.com/openjaf/api_directory/tree/master/apis/amazons3/raml_0.8,,,"Since 2006 Amazon Web Services has been offering web services commonly known as cloud computing. AWS Provides a reliable, low cost infrastructure platform that powers hundreds of thousands of businesses. Amazon S3 API, the Simple Storage Service provides a simple web services interface used to store objects using the Amazon online storage infrastructure. Users can then download the data or use the data with other AWS services, such as Amazon Elastic Cloud Computer (EC2). Using this web service, developers can build applications that make use of Internet storage. The API uses Buckets, Objects, Keys and Operations. An object has four parts: value, key, metadata, and an access control policy. Objects are stored in buckets. The API is available in both REST and SOAP protocol. Responses are formatted in XML.",Amazon S3 is an online storage web service offered by Amazon Web Services.,,,cloud-storage,Developer Tools,,,,,,,,,
amazon-ses,Amazon SES,,,,,,,,,,,"Amazon Simple Email Service, or SES, provides cloud-based email as a service. Amazon SES simplifies sending emails from applications being hosted on services such as Amazon EC2. Because email services are often used by spammers, Amazon SES provides each user with a quota. EC2 users can send 2,000 emails per day for free. The service allows developers to send either raw email or formatted email using Amazon's SMTP servers. Any spam complaints or other issues bubble back up to the developer. Similar to other Amazon Web Services, Amazon SES charges per gigabyte for transfer in and out of its systems.",,,,,Developer Tools | Email marketing,,,,,,,,,
amazon-simpledb,Amazon SimpleDB,http://aws.amazon.com/simpledb/,,,,,,,,,,,Amazon SimpleDB is a highly available and flexible non-relational data store that offloads the work of database administration.,,,database,Developer Tools,,,,,,,,,
amazon-sms,Amazon SNS,,,,,,,,,,"Amazon Simple Notification Service is a flexible, and fast messaging service which is fully managed. SNS is a simple and cost-effective method to message both distributed services and human recipients.",,,,,,Developer Tools,,,,,,,,,
amazon-sqs,Amazon SQS,,,,,,,,,,Amazon Simple Queue Service is a simple but powerful services for generating and consuming messages. It can help decouple systems for improved scalability and robustness.,,,,,,Developer Tools,,,,,,,,,
ambassador,Ambassador,https://www.getambassador.com,,,,,,,,,,"Ambassador is a service that allows companies and brands to reward their customers for promoting products and services to their social networks. The Ambassador API allows developers to integrate Ambassador into sites and applications. Some example API methods include listing events, accessing ambassadors account information, creating rewards, and adding discounts and deals.",Ambassador is a social marketing platform providing the tools to reward your customers for referrals.,,,,Billing | Accounting,,,,,,,,,
analytic-call-tracking,Analytic Call Tracking,,,,,,,,,,Analytic Call Tracking (ACT) helps route and track calls with full analytic reporting.,,,,,,Phone,,,,,,,,,
angellist,AngelList,https://angel.co,,,,,,,,,,"AngelList is a community of startups and investors with the goal of making fund raising efficient. Angel investors are listed along with contact information which startups can use to set up introductions. The AngelList API provides developers with a RESTful interface to the AngelList data set. Data includes followers, reviews, startups and more. Responses are formatted in JSON and JSONP",AngelList is a platform for startups.,,,social,Social,,,,,,,,,
ansible,Ansible,http://www.ansible.com,,,,,,,,,,,Ansible is the simplest way to automate apps and IT infrastructure. Application Deployment + Configuration Management + Continuous Delivery.,,,,,,,,,,,,,
apollo,Apollo,https://www.apollohq.com,,,,,,,,,,,Apollo is an online project and contact management service.,,,project-management,,,,,,,,,,
appdotnet,App.net,https://app.net,,,,,,,,,,,"It's your real-time feed, a home for meaningful conversation, where you control your data.",,,social,,,,,,,,,,
appharbor,AppHarbor,https://appharbor.com,,,,,,,,,,,AppHarbor is a cloud platform as a service (PaaS) that supports applications running on the .NET Framework.,,,cloud-platform,,,,,,,,,,
appointlet,Appointlet,,,,,,,,,,Appointlet is an appointment scheduler built on top of Google Calendar. Enable your clients to book appointments with you right from your website.,,,,,,Event Management,,,,,,,,,
artifactory,Artifactory,https://www.jfrog.com/artifactory/,,,,,,,,,,,"Binary Repository Manager for Maven, Ivy, Gradle modules, etc. Supports hosting and remote proxying of artifacts.",,,,,,,,,,,,,
asana,Asana,https://asana.com,,,,,,,,,,"Asana is an online platform for teams to manage and share tasks. Asana offers both web and mobile applications for teams to organize, assign, and track task management items. The Asana API allows developers to access and integrate the functionality of Asana with other applications and to create new applications. Some example API methods include managing users, creating and managing tasks, and accessing projects and workspaces.","Asana is the shared task list for your team. The place to plan, organize and stay in sync on your efforts.",,,project-management,Project Management,,,,,,,,,
assembla,Assembla,https://www.assembla.com/home,,,,,,,,,,,"Assembla provides task management, agile planning, repository, and collaboration tools to manage agile teams and achieve continuous delivery.",,,project-hosting,,,,,,,,,,
authorize-net,Authorize.net,,,,,,,,,,Authorize.net is a world leading payment system.,,,,,,Ecommerce,,,,,,,,,
autopilot,Autopilot,,,,,,,,,,,"The Autopilot API allows developers to integrate their applications with the Autopilot marketing automation platform. The API provides methods for capturing leads, adding contacts, triggering Autopilot journeys, syncing unsubscribes, adding to the Autopilot activity feed, customizing contact profiles, and getting data from a third-party app into Salesforce. Customer journeys can be set up easily using a drag-and-drop interface.",,,,,CRM,,,,,,,,,
autoremote,AutoRemote,,,,,,,,,,Control your phone remotely with Tasker and AutoRemote.,,,,,,Phone,,,,,,,,,
aweber,AWeber,http://www.aweber.com,,,,,,,,,,,Email marketing software that's easy to use & only $1 to try. Send email newsletters & autoresponders.,,,email-marketing,Email marketing | Phone,,,,,,,,,
aws-lambda,AWS Lambda,,,,,,,,,,"AWS Lambda is a compute service that runs your code in response to events and automatically manages the compute resources for you, making it easy to build applications that respond quickly to new information.",,,,,,Developer Tools,,,,,,,,,
axosoft,Axosoft,,,,,,,,,,Axosoft is agile project management for software development teams.,,,,,,Project Management,,,,,,,,,
backpack,Backpack,https://basecamp.com/backpack-retired,,,,,,,,,,,"Backpack makes it easy to keep all of your essential documents, information, schedules in one place all the time.",,,,,,,,,,,,,
backupify,Backupify,,https://any-api.com/consoles/backupify.com/1.0.0,,,,,,,,,,,,,,,,,,,,,,,
balanced-payments,Balanced,,,,,,,,,,,,,,,,,,,,,,,,,
bamboo,Bamboo,https://www.atlassian.com/software/bamboo,,,,,,,,,,,"Atlassian Bamboo CI software automates building, testing, deploying, and releasing software.",,,continuous-integration,,,,,,,,,,
bamboohr,BambooHR,http://www.bamboohr.com,,,,,,,,,,,"Simple, easy-to-use, affordable HR software.",,,hr,,,,,,,,,,
barcloud,BarCloud,,,,,,,,,,"BarCloud is an online, barcode-based inventory and asset management system. The solution includes Android and iOS devices as fully functional barcode readers with their own App downloadable from the App Store.",,,,,,Ecommerce,,,,,,,,,
base-crm,Base CRM,https://getbase.com,,,,,,,,,,,A simple and powerful CRM. Tens of thousands of businesses use Base to manage contacts and track sales.,,,crm,CRM,,,,,,,,,
basecamp,Basecamp,https://basecamp.com,,,,,,,,,,"From 37signals. Basecamp is a unique project collaboration tool. Projects don't fail from a lack of charts, graphs, or reports, they fail from a lack of communication and collaboration. Basecamp makes it simple to communicate and collaborate on projects. The Basecamp API is implemented as vanilla XML over HTTP.","Trusted by millions, Basecamp is the leading web-based project management and collaboration tool. To-dos, files, messages, schedules, and milestones.",,,project-management,Project Management,,,,,,,,,
basecamp-classic,Basecamp Classic,https://basecamp.com/classic,,,,,,,,,,,The original web-based project management app: Basecamp Classic is the one that started it all.,,,project-management,Project Management | Time Tracking,,,,,,,,,
batchbook,Batchbook,http://batchbook.com,,,,,,,,,,BatchBook is an easy-to-use customer relationship manager (CRM) designed for small business owners. The BatchBook API is an XML REST interface for accessing your account.,Batchbook is your small business CRM solution. Build meaningful relationships with customers with their easy to use tool.,,,crm,CRM,,,,,,,,,
bazaar,Bazaar,http://bazaar.canonical.com/en/,,,,,,,,,,,Bazaar is a distributed revision control system sponsored by Canonical.,,,version-control,,,,,,,,,,
bbc,BBC Nitro,,https://any-api.com/consoles/bbc.com/1.0.0,,,,,,,,,,,,,,,,,,,,,,,
bbm,BlackBerry Messenger,http://us.blackberry.com/bbm.html,,,,,,,,,,,"BlackBerry Messenger (BBM) is a proprietary Internet-based PIN instant messenger and videotelephony application included on BlackBerry devices that allows messaging and voicecalls between BlackBerry, iOS, Windows Phone and Android users.",,,messaging,,,,,,,,,,
beaconpush,Beaconpush,http://beaconpush.com,,,,,,,,,,,Beaconpush is a push service for creating real-time web apps using HTML5 WebSockets and Comet.,,,,,,,,,,,,,
beanstalk,Beanstalk,http://beanstalkapp.com,,,,,,,,,,"Beanstalk is a hosted subversion service that allows designers and developers to store source code, track changes, and collaborate with their team. The API can be used to build tools or services around Beanstalk account information. It uses a RESTful protocol and responses are formatted in XML. ","Beanstalk allows designers and developers to store source code, track changes, and collaborate with their team through Git, Subversion and Mercurial version control systems.",,,project-hosting,Developer Tools,,,,,,,,,
beanstream,Beanstream Payments,,https://any-api.com/consoles/beanstream.com/1.0.1,,,,,,,,,,,,,,,,,,,,,,,
beeminder,Beeminder,,,,,,,,,,,"Beeminder is a goal tracking service that allows users to set goals and track their progress towards them with incentives along the way. The Beeminder API allows developers to access and integrate the functionality of Beeminder with other applications and to create new applications. The API methods include retrieving information about users, retrieving information about goals, and retrieving datapoints.",,,,,Time Tracking,,,,,,,,,
beeper,Beeper,,,,,,,,,,"Beeper is a mobile application with a modern approach for receiving urgent, contextual messages on mobile devices.",,,,,,Messaging | Phone,,,,,,,,,
beepsend,Beepsend SMS,,,,,,,,,,,"Beepsend provides messaging services to mobile operators, SMS aggregators, and enterprise clients. The Beepsend API exposes a variety of SMS services and support functions. The API is able to send messages, retrieve analytics, manage contacts, and much more. The API is available as a robust RESTful API as well as a light weight HTTP API.",,,,,Marketing | Phone,,,,,,,,,
benchmark-email,Benchmark Email,,,,,,,,,,"Benchmark is an international, easy-to-use email marketing and event management tool. Affordable, friendly and stylish.",,,,,,Email Marketing,,,,,,,,,
